{
  "$schema": "https://schema.supra-wall.com/v1/policy.schema.json",
  "name": "OpenAI Assistants Safe",
  "version": "1.0.0",
  "description": "Security layer for OpenAI Assistants tool calls",
  "rules": [
    {
      "name": "Block System File Access",
      "tool": "file_search",
      "action": "DENY",
      "condition": {
        "type": "regex",
        "pattern": "/etc/|/var/|/root/"
      },
      "message": "Assistant is restricted from searching system-level paths."
    },
    {
      "name": "Approve Large File Retrieval",
      "tool": "code_interpreter:list_files",
      "action": "REQUIRE_APPROVAL",
      "message": "Retrieving file lists from code interpreter requires approval to prevent bulk exfiltration."
    }
  ]
}
