{
  "$schema": "https://schema.supra-wall.com/v1/policy.schema.json",
  "name": "PII Protection Shield",
  "version": "1.0.0",
  "description": "Deterministic regex-based PII exfiltration protection",
  "rules": [
    {
      "name": "Block SSN Exfiltration",
      "tool": "*",
      "action": "DENY",
      "condition": {
        "type": "regex",
        "pattern": "\\b\\d{3}-\\d{2}-\\d{4}\\b"
      },
      "message": "Potential Social Security Number detected in tool arguments. Action blocked."
    },
    {
      "name": "Block Credit Card Numbers",
      "tool": "*",
      "action": "DENY",
      "condition": {
        "type": "regex",
        "pattern": "\\b(?:4[0-9]{12}(?:[0-9]{3})?|5[1-5][0-9]{14}|6(?:011|5[0-9][0-9])[0-9]{12}|3[47][0-9]{13}|3(?:0[0-5]|[68][0-9])[0-9]{11}|(?:2131|1800|35\\d{3})\\d{11})\\b"
      },
      "message": "Potential Credit Card Number detected in tool arguments. Action blocked."
    },
    {
      "name": "Approve Email Sequences",
      "tool": "*",
      "action": "REQUIRE_APPROVAL",
      "condition": {
        "type": "regex",
        "pattern": "[a-zA-Z0-9._%+-]+@[a-zA-Z0-9.-]+\\.[a-zA-Z]{2,}"
      },
      "message": "Possible email exfiltration detected. Human approval required."
    }
  ]
}
